<Payload xmlns="http://rolep.net"
         xmlns:xsi="http://www.w3.org/2001/XMLSchema-instance"
         xsi:schemaLocation="http://rolep.net myPayload.xsd">
    <Users>
        <User flag="active" city="kiv" email="gmail@gmail.com">
            <fullName>Full Name</fullName>
            <!--<city>Киев</city>-->
        </User>
        <User flag="superuser" city="spb" email="admin@javaops.ru">
            <fullName>Admin</fullName>
            <groups>masterjava02 topjava10</groups>
        </User>
        <User flag="deleted" city="spb" email="mail@yandex.ru">
            <fullName>Deleted</fullName>
            <groups>topjava09 topjava10</groups>
            <!--<city>Санкт-Петербург</city>-->
        </User>
    </Users>
    <Cities>
        <City id="spb">Санкт-Петербург</City>
        <City id="kiv">Киев</City>
        <City id="mnsk">Минск</City>
    </Cities>
    <Projects>
        <Project>
            <name>MasterJava</name>
            <description>Разработка полнофункционального многомодульного Maven проекта</description>
        </Project>
        <Project>
            <name>TopJava</name>
            <description>Наиболее востребованные технологии /инструменты / фреймворки Java Enterprise: Maven/ Spring/
                Security/ JPA(Hibernate)/ REST(Jackson)/ Bootstrap(CSS)/ jQuery + plugins</description>
        </Project>
    </Projects>
    <Groups>
        <Group groupType="CURRENT">
            <name>topjava10</name>
            <project>TopJava</project>
        </Group>
        <Group groupType="FINISHED">
            <name>TopJava09</name>
            <project>TopJava</project>
        </Group>
        <Group groupType="CURRENT">
            <name>masterjava02</name>
            <project>MasterJava</project>
        </Group>
    </Groups>
</Payload>